{"concepts":[{"definition":"Discrete executable units: step_in, plant, pivot, reach, strike_like, dodge, recoil, fall, recovery, grab — the shared language between extraction and generation","id":"c_action_atoms","kind":"concept","layer":"action","name":"Action-atom vocabulary","source_refs":["CPCS §6.3","RDC §22.2"],"status":"proven"},{"definition":"Smears, impact flashes, speed lines, motion echo, energy trails, dust, held/repeated frames, background abstraction — timed events attached to actions, separable from physical motion","id":"c_anime_vfx_layer","kind":"structure","layer":"vfx","name":"Anime VFX event layer","source_refs":["RDC §22.8 §23.5"],"status":"partial"},{"definition":"Decompose video to the smallest TRANSFER-USEFUL units (one gaze shift, one foot plant, one caption pop) — each atom carries time, type, subject, value, evidence class, confidence, provenance","id":"c_atomic_deconstruction","kind":"doctrine","layer":"extraction","name":"Atomic deconstruction","source_refs":["RDC §2.1"],"status":"partial"},{"definition":"Asset -> Sequence -> Scene -> Shot -> Beat -> Action -> Motion primitive -> Micro-event -> Frame, with 11 cross-cutting layers so one phrase never smears acting+camera+marketing together","id":"c_atomic_ontology","kind":"structure","layer":"extraction","name":"9-level atomic ontology","source_refs":["RDC §5"],"status":"partial"},{"definition":"What makes video read creator-made: direct lens address, casual environment, self-correction, incomplete sentences, off-axis gaze, handling noise, unpolished transitions — identifiable semantically, quantifiable by measurement","id":"c_authenticity_cues","kind":"concept","layer":"performance","name":"Authenticity cue inventory","source_refs":["RDC §16.2","lab/references/iphone_rawugc_realism.md"],"status":"proven"},{"definition":"Models render one continuous ~4-8s shot; split the ad one clip per beat, trim, hard jump cuts — the cuts ARE authentic UGC","id":"c_beat_per_clip","kind":"workflow","layer":"workflow","name":"Beat-per-clip build","source_refs":["SKILL.md"],"status":"proven"},{"definition":"Explicit camera position/orientation over time — the shot path as data","id":"c_camera_keyframes","kind":"technique","layer":"camera","name":"Camera position keyframes","source_refs":["lab/blocks.yaml#blk_camera_keyframes"],"status":"proven"},{"definition":"Model input boxes cap ~2000 chars; compact combined formats carry every lever in one paste; verify with wc -c never eyeball","id":"c_char_budget","kind":"policy","layer":"packaging","name":"Char-budget discipline","source_refs":["AGENTS.md"],"status":"proven"},{"definition":"Analyze difficult passages independently via start/end times; Pegasus 1.5 clipping requires a MINIMUM 4-SECOND window — pad short events and resolve times back to source clock","id":"c_clipped_analysis","kind":"policy","layer":"extraction","name":"Clipped analysis (4s minimum)","source_refs":["RDC §9.3"],"status":"partial"},{"definition":"hook -> problem -> product_reveal -> demonstration -> proof -> CTA with timing locks (product <3s, proof before CTA, CTA >=2.5s)","id":"c_communication_graph","kind":"structure","layer":"marketing","name":"UGC communication graph","source_refs":["SKILL.md"],"status":"proven"},{"definition":"Tier 1 text-only -> 2 key poses -> 3 pose-conditioned video -> 4 rigged animation intermediate (pose/mask/depth/flow control passes) -> 5 video-to-video appearance transfer. Exact movement normally needs Tier 3+","id":"c_compilation_tiers","kind":"structure","layer":"compilation","name":"5 compilation tiers","source_refs":["RDC §28 §19"],"status":"partial"},{"definition":"contacts[] with region_a/region_b, start/end, type (impact|near_miss|grasp), tolerance_m — strikes land on time, hands don't phase through","id":"c_contact_solver","kind":"technique","layer":"action","name":"Timed contact events","source_refs":["lab/blocks.yaml#blk_contact_solver"],"status":"proven"},{"definition":"Four separable layers: action content (walk->reach) / performance (hesitant, bound) / style transform (natural|anime|superhuman) / presentation (handheld close|locked wide). Collapsing them into one style_intensity scalar makes controlled transfer impossible","id":"c_content_perf_style_presentation","kind":"doctrine","layer":"transfer","name":"Content/performance/style/presentation separation","source_refs":["MX §28.1"],"status":"partial"},{"definition":"Coupled artifacts grow/shrink together, deterministically: research package added -> alias + cards + CONCEPT_INDEX part + graph rebuild enforced; package removed -> dangling aliases/cards/index flagged with ordered REQUIRED ACTIONS; runbooks <-> routing table both directions; graph.json is derived and freshness-checked. sync_repo.py is the manager; gate check [10] blocks drift from ever committing","id":"c_control_plane","kind":"policy","layer":"operations","name":"E2E control plane (sync contract)","source_refs":["lab/scripts/sync_repo.py","AGENTS.md#sync-contract"],"status":"partial"},{"definition":"Naturalism = a LOW-FREQUENCY, task-aware, correlated variation process with limits + a seed (reproducible) — NOT independent random jitter per joint/frame, which produces vibration not life. Refines microvariation","id":"c_correlated_variation","kind":"technique","layer":"quality","name":"Correlated variation, not white noise","source_refs":["MX §16","research/CPCS_MX_Hierarchical_Motion_Grammar_Research_Package_v1.0/docs/AGENT_WORKFLOW_RECIPES.md"],"status":"partial"},{"definition":"Pose, masks, depth, flow, camera paths live as video/arrays/BVH/glTF — never serialized into prose or bloated text formats; text carries semantics, media carries density","id":"c_dense_assets_media","kind":"policy","layer":"packaging","name":"Dense signals stay as media","source_refs":["RDC §6.5"],"status":"partial"},{"definition":"A genuine smile = cheeks raise WITH the mouth (AU6+AU12); mouth-only smiles read fake/creepy","id":"c_duchenne","kind":"technique","layer":"face","name":"Duchenne smile rule","source_refs":["lab/references/facs_laban_reference.md","CPCS §4.4"],"status":"partial"},{"definition":"Operationalize Laban from measurable motion: speed/accel -> Time, path directness -> Space, smoothness/jerk -> Flow, vertical drop/impact -> Weight — turns the effort WORDS into computable/checkable quantities","id":"c_effort_proxies","kind":"technique","layer":"quality","name":"Laban effort computational proxies","source_refs":["MX §13"],"status":"partial"},{"definition":"Per-interval weight/time/space/flow in [-1,1] — movement QUALITY as numbers per beat","id":"c_effort_vectors","kind":"technique","layer":"quality","name":"Laban effort as numeric vectors","source_refs":["lab/blocks.yaml#blk_effort_vectors"],"status":"proven"},{"definition":"measured / detected / inferred / interpreted / authored — every claim typed by how it was obtained; Pegasus enters as interpreted/inferred, never measured","id":"c_evidence_classes","kind":"policy","layer":"extraction","name":"Evidence classes","source_refs":["RDC §4.3","lab/RUNBOOK_pegasus_extraction.md"],"status":"proven"},{"definition":"Pick the carrier by fidelity need: semantic->text prompt; key poses->sparse frames; exact screen-space body->pose-control video; editable contact/balance->rigged animation+IK; precise camera->camera trajectory; exact masks->segmentation video; stylized timing->edit/compositor package","id":"c_execution_carrier","kind":"policy","layer":"compilation","name":"Execution carrier selection","source_refs":["MX §24","research/CPCS_MX_Hierarchical_Motion_Grammar_Research_Package_v1.0/docs/AGENT_WORKFLOW_RECIPES.md"],"status":"partial"},{"definition":"Eye darts, gentle blinks, brow flickers, cheek/lip micro-shifts, talking mouth shapes, head bobs synced to speech — never a frozen face","id":"c_face_motion_alive","kind":"technique","layer":"face","name":"Alive face-motion layer","source_refs":["lab/blocks.yaml#blk_face_motion_alive"],"status":"proven"},{"definition":"Face as a SEQUENCE of AU events with start/end (brow-raise -> knit -> sharpen -> soften), intensities B-C, translated to plain language for the model","id":"c_facs_events","kind":"technique","layer":"face","name":"Timed FACS event sequence","source_refs":["lab/references/facs_laban_reference.md","CPCS §4.2"],"status":"partial"},{"definition":"12 named failures with fixes: truncated JSON -> reduce scope; timestamp drift -> snap; identity swap -> masks+review; false contact -> ambiguous class; UGC too polished -> enforce imperfections; motion not reproduced -> escalate tier; identity leak -> neutral render","id":"c_failure_modes","kind":"reference","layer":"operations","name":"Failure-mode -> deterministic-response table","source_refs":["RDC §38"],"status":"partial"},{"definition":"realism / skin / motion / adherence 1-5 per run — the lab's working subset of the 8-layer fidelity model","id":"c_fidelity_scoring","kind":"metric","layer":"validation","name":"Lab rating dimensions","source_refs":["lab/runs/results.csv","lab/registry.yaml"],"status":"proven"},{"definition":"Each format owns the controls it does best: YAML = creative intent, style extends:, Laban words, affect, marketing, safety, high-level constraints (human-readable+inheritable). JSON = kinematics, contacts, camera 6DoF, verification, provenance (exact machine-validated arrays). XML = ordered script, FACS/gaze/breath event triggers, VFX+audio cues via namespaces (ordered mixed content). JSONL = evidence stream; dense signals stay media. XML references the JSON by hash — one authority per quantity","id":"c_format_control_map","kind":"policy","layer":"packaging","name":"Format-to-control assignment (YAML=intent, JSON=precision, XML=order/triggers)","source_refs":["lab/FORMAT_CONTROL_MAP.md","CPCS §19.3-19.8","RDC §6"],"status":"partial"},{"definition":"Curate the format combo by user intent (exact motion=JSON only; tweak-style-myself=YAML->JSON; script+SFX cues=XML+JSON; semantic-first=YAML+XML; full production=